{
  "$schema": "../schemas/scenario-catalog.schema.json",
  "schema_version": 1,
  "family": "CMD-02",
  "viewports": [
    { "id": "640x480", "width": 640, "height": 480, "device_scale_factor": 1 },
    { "id": "1280x800-letterboxed", "width": 1280, "height": 800, "device_scale_factor": 1 }
  ],
  "factions": ["alliance", "empire"],
  "scenarios": [
    { "index": 0, "slug": "galaxy", "requirement": "galaxy", "mode": null, "category": null, "leaf": null },
    { "index": 1, "slug": "sector", "requirement": "sector", "mode": null, "category": null, "leaf": null },
    { "index": 2, "slug": "system", "requirement": "system", "mode": null, "category": null, "leaf": null },
    { "index": 3, "slug": "display-off", "requirement": "display off", "mode": "Display Off", "category": null, "leaf": null },
    { "index": 4, "slug": "popular-support", "requirement": "support", "mode": "Popular Support", "category": 0, "leaf": 0 },
    { "index": 5, "slug": "uprising", "requirement": "uprising", "mode": "Uprisings", "category": 0, "leaf": 1 },
    { "index": 6, "slug": "fleets", "requirement": "fleets", "mode": "Idle Fleets", "category": 1, "leaf": 0 },
    { "index": 7, "slug": "personnel", "requirement": "personnel", "mode": "Idle Personnel", "category": 2, "leaf": 0 },
    { "index": 8, "slug": "energy", "requirement": "energy", "mode": "Available Energy", "category": 3, "leaf": 0 },
    { "index": 9, "slug": "raw-material", "requirement": "raw materials", "mode": "Available Raw Material", "category": 3, "leaf": 1 },
    { "index": 10, "slug": "mines", "requirement": "mines", "mode": "Mines", "category": 3, "leaf": 2 },
    { "index": 11, "slug": "refineries", "requirement": "refineries", "mode": "Refineries", "category": 3, "leaf": 3 },
    { "index": 12, "slug": "shipyards", "requirement": "shipyards", "mode": "Shipyards", "category": 4, "leaf": 0 },
    { "index": 13, "slug": "training", "requirement": "training", "mode": "Training Facilities", "category": 4, "leaf": 2 },
    { "index": 14, "slug": "construction", "requirement": "construction", "mode": "Construction Yards", "category": 4, "leaf": 4 },
    { "index": 15, "slug": "defenses", "requirement": "defenses", "mode": "Planetary Defense Batteries", "category": 5, "leaf": 0 },
    { "index": 16, "slug": "matching-legend", "requirement": "matching legend", "mode": "Popular Support", "category": 0, "leaf": 0 },
    { "index": 17, "slug": "known", "requirement": "known", "mode": "Popular Support", "category": null, "leaf": null },
    { "index": 18, "slug": "unknown", "requirement": "unknown", "mode": "Popular Support", "category": null, "leaf": null },
    { "index": 19, "slug": "uninhabited", "requirement": "uninhabited", "mode": "Popular Support", "category": null, "leaf": null },
    { "index": 20, "slug": "headquarters", "requirement": "HQ", "mode": "Popular Support", "category": null, "leaf": null },
    { "index": 21, "slug": "blockade", "requirement": "blockade", "mode": "Popular Support", "category": null, "leaf": null },
    { "index": 22, "slug": "mission", "requirement": "mission", "mode": "Popular Support", "category": null, "leaf": null },
    { "index": 23, "slug": "fleet", "requirement": "fleet", "mode": "Popular Support", "category": null, "leaf": null },
    { "index": 24, "slug": "death-star-intelligence", "requirement": "Death Star intelligence", "mode": "Popular Support", "category": null, "leaf": null },
    { "index": 25, "slug": "hover", "requirement": "hover", "mode": "Popular Support", "category": null, "leaf": null },
    { "index": 26, "slug": "selection", "requirement": "selection", "mode": "Popular Support", "category": null, "leaf": null },
    { "index": 27, "slug": "pan", "requirement": "pan", "mode": "Popular Support", "category": null, "leaf": null },
    { "index": 28, "slug": "zoom", "requirement": "zoom", "mode": "Popular Support", "category": null, "leaf": null },
    { "index": 29, "slug": "fleets-enroute", "requirement": "fleets enroute filter", "mode": "Fleets Enroute", "category": 1, "leaf": 1 },
    { "index": 30, "slug": "active-personnel", "requirement": "active personnel filter", "mode": "Active Personnel", "category": 2, "leaf": 1 },
    { "index": 31, "slug": "idle-shipyards", "requirement": "idle shipyards filter", "mode": "Idle Shipyards", "category": 4, "leaf": 1 },
    { "index": 32, "slug": "idle-training", "requirement": "idle training facilities filter", "mode": "Idle Training Facilities", "category": 4, "leaf": 3 },
    { "index": 33, "slug": "idle-construction", "requirement": "idle construction yards filter", "mode": "Idle Construction Yards", "category": 4, "leaf": 5 },
    { "index": 34, "slug": "troopers", "requirement": "troopers filter", "mode": "Troopers", "category": 5, "leaf": 3 },
    { "index": 35, "slug": "fighter-squadrons", "requirement": "fighter squadrons filter", "mode": "Fighter Squadrons", "category": 5, "leaf": 2 },
    { "index": 36, "slug": "death-star-shields", "requirement": "Death Star shields filter", "mode": "Death Star Shields", "category": 5, "leaf": 4 },
    { "index": 37, "slug": "planetary-shields", "requirement": "planetary shield generators filter", "mode": "Planetary Shield Generators", "category": 5, "leaf": 1 }
  ]
}
